{
  "schemaVersion": "1.0.0",
  "contractId": "hosted-sandbox-remediation-v1-1",
  "requestId": "HSR11-PHASE-1-SCOPE-CHANGE-001",
  "reason": "PHASE-1 activation preflight reports CHANGE_REQUEST_REQUIRED because several locked allowedModifyPaths do not exist in the current repository and several real PHASE-1 implementation surfaces are outside the locked phase scope. The request aligns PHASE-1 scope with the existing repo file map before any product code edit.",
  "affectedRequirementIds": [
    "HSR11-101",
    "HSR11-102",
    "HSR11-103",
    "HSR11-104"
  ],
  "requestedCreatePaths": [
    "app/src/lib/commercial-email.ts",
    "app/src/lib/phase-83b-commercial-entitlement-model.server.ts",
    "app/src/lib/supabase-server-readonly.ts",
    "app/src/lib/trusted-proxy.ts",
    "app/tests/commercial-auth-browser-boundary.test.ts",
    "app/tests/request-id-error-propagation.test.ts",
    "app/tests/supabase-rsc-readonly-client.test.ts",
    "app/tests/trusted-proxy-boundary.test.ts"
  ],
  "requestedModifyPaths": [
    "app/src/components/admin-login-form.tsx",
    "app/src/lib/phase-84d-customer-auth.ts",
    "app/src/lib/phase-84d-customer-auth.test.ts",
    "app/src/lib/phase-83b-commercial-entitlement-model.ts",
    "app/src/lib/phase-83b-commercial-entitlement-model.test.ts",
    "app/src/lib/use-manu-state.ts",
    "app/src/lib/app-errors.ts",
    "app/src/lib/hosted-sandbox-runtime-fixes.test.ts",
    "app/src/app/api/api-errors.test.ts",
    "app/src/lib/supabase.ts",
    "app/src/lib/dashboard-server-auth.ts",
    "app/src/lib/settings-server-read.ts",
    "app/src/lib/auth-context.ts",
    "app/src/lib/commercial-admin-access.ts",
    "app/src/lib/commercial-install-access.ts",
    "app/src/app/**/page.tsx",
    "app/src/app/**/layout.tsx",
    "app/src/lib/demo-fixture-access.ts",
    "app/src/lib/rate-limit.ts",
    "app/src/lib/commercial-public-rate-limit.ts",
    "app/src/lib/phase-83g-entitlement-hardening.ts",
    "app/src/lib/phase-85-stage-4d-auth-server.ts",
    "app/src/app/api/**/route.ts"
  ],
  "requestedCommands": [
    "node tools/execution-governance/governance-cli.mjs validate --plan-dir .execution-governance/plans/hosted-sandbox-remediation-v1-1 --phase-id PHASE-1",
    "node tools/execution-governance/governance-cli.mjs cursor-session --session preflight --plan-dir .execution-governance/plans/hosted-sandbox-remediation-v1-1 --phase-id PHASE-1",
    "npm run typecheck",
    "npm run build",
    "npm run test -- --run src/lib/phase-84d-customer-auth.test.ts src/lib/phase-83b-commercial-entitlement-model.test.ts src/lib/hosted-sandbox-runtime-fixes.test.ts src/app/api/api-errors.test.ts",
    "npm run test -- --run tests/commercial-auth-browser-boundary.test.ts tests/request-id-error-propagation.test.ts tests/supabase-rsc-readonly-client.test.ts tests/trusted-proxy-boundary.test.ts"
  ],
  "architectureImpact": "No new architecture is requested. The change updates the locked PHASE-1 scope to match existing component, request error, Supabase server-client, RSC reader, and trusted proxy/auth helper surfaces already present in the repository.",
  "securityPrivacyImpact": "The request preserves fail-closed Cursor activation, tenant/account/actor boundaries, no secret reads, no health-data logging, no dependency changes, no migrations, no network egress, and production NO-GO. It narrows risk by preventing Cursor activation against stale or nonexistent paths.",
  "requiredTests": [
    "PHASE-1 selected plan validation",
    "Cursor session PHASE-1 preflight must no longer report missing concrete allowedModifyPaths after approved plan relock",
    "Targeted commercial auth browser-boundary tests",
    "Targeted requestId error propagation tests",
    "Targeted Supabase RSC read-only client tests",
    "Targeted trusted-proxy boundary tests",
    "npm run typecheck",
    "npm run build",
    "governance scope-check, run-checks, postflight, and close for the approved PHASE-1 scope"
  ],
  "rollbackImpact": "Rollback is reverting the scope-change approval commit and regenerated lock before PHASE-1 implementation starts. No product code, database schema, dependency, production gate, deployment, push, or external system state is changed by this request.",
  "planVersionChange": "requires new plan version and lock hash for hosted-sandbox-remediation-v1-1 before PHASE-1 implementation or Cursor activation",
  "status": "APPROVED_BY_USER"
}
